{"schema_version":"1.0.0","business_flow_id":"flow_launch001","root_task_id":"flow_launch001:root","scenario_id":"scenario_launch","scenario_version_id":"scenario_launch:v1","scenario_sha256":"aaaaaaaaaaaaaaaaaaaaaaaaaaaaaaaaaaaaaaaaaaaaaaaaaaaaaaaaaaaaaaaa","title":"产品发布准备","objective":"形成发布方案","status":"running","root_deliverable_id":null,"work_orders":[{"id":"flow_launch001:work:research","node_id":"research","child_task_id":"flow_launch001:task:research","assignee_agent_id":"researcher-001","role":"executor","goal":"研究","status":"ready","revision":1},{"id":"flow_launch001:work:finalize","node_id":"finalize","child_task_id":"flow_launch001:task:finalize","assignee_agent_id":"researcher-001","role":"finalization","goal":"汇总","status":"waiting_dependency","revision":1}]}
